{
  "$comment": "GENERATED by contracts/codegen/generate.py from hardware_unit.schema.yaml - DO NOT EDIT.",
  "$schema": "https://json-schema.org/draft/2020-12/schema",
  "additionalProperties": true,
  "description": "A physical device with a lifecycle (camera/fob/sd/gripper) \u2014 current-state view (CONTRACT \u00a73.1).",
  "properties": {
    "batch_id": {
      "description": "Provisioning batch (order\u2192batch\u2192unit, \u00a73.1).",
      "type": [
        "string",
        "null"
      ]
    },
    "board": {
      "description": "Board type (fobs, e.g. esp32-cyd; the per-fob profile, with provisioning.firmware_version).",
      "type": [
        "string",
        "null"
      ]
    },
    "body_serial": {
      "description": "Immutable body serial (provenance/crosswalk; \u00a73.4; null until provisioned).",
      "type": [
        "string",
        "null"
      ]
    },
    "camera_id": {
      "description": "LOGICAL camera identity (registry-allocated, globally unique, unchanging, retire-not-reuse). The body_serial\u2194camera_id crosswalk; cameras only (null otherwise).",
      "type": [
        "string",
        "null"
      ]
    },
    "fob_id": {
      "description": "Logical fob identity (fobs only; matches sidecar provenance.fob_id).",
      "type": [
        "string",
        "null"
      ]
    },
    "hardware_catalog_id": {
      "description": "Reference to hardware_catalog.catalog_id (V1 catalog). Admin-set; null until cataloged.",
      "type": [
        "string",
        "null"
      ]
    },
    "hardware_version": {
      "description": "Hardware revision.",
      "type": [
        "string",
        "null"
      ]
    },
    "insv_serial": {
      "description": "The IAQEB .insv serial \u2014 the \u00a73.4 crosswalk key; immutable; NEVER decides the kit (\u00a73.3).",
      "type": [
        "string",
        "null"
      ]
    },
    "kit_id": {
      "description": "Current kit binding (as-of; the binding history lives in events, OQ-4). Serials NEVER decide this (\u00a73.3).",
      "type": [
        "string",
        "null"
      ]
    },
    "mac": {
      "description": "MAC address (provisioning fact, R-2).",
      "type": [
        "string",
        "null"
      ]
    },
    "mount": {
      "description": "Mount config (cameras) \u2014 promoted from sidecar-only into the per-unit registry profile.",
      "type": [
        "string",
        "null"
      ]
    },
    "order_id": {
      "description": "Provisioning order (order\u2192batch\u2192unit, \u00a73.1).",
      "type": [
        "string",
        "null"
      ]
    },
    "provisioning": {
      "additionalProperties": true,
      "description": "Provisioning/connection facts captured at provision time (R-2). ONE nesting level.",
      "properties": {
        "firmware_version": {
          "description": "Firmware version recorded at provisioning.",
          "type": "string"
        },
        "ip_scheme": {
          "description": "Assigned IP scheme.",
          "type": "string"
        },
        "wifi_ap": {
          "description": "AP details.",
          "type": "string"
        },
        "wifi_ssid": {
          "description": "Camera/AP WiFi SSID (identity-only; never the PSK \u2014 fleet_registry secrets-separation).",
          "type": "string"
        }
      },
      "required": [],
      "type": "object"
    },
    "schema": {
      "description": "Schema identifier; additive semver (\u00a75).",
      "enum": [
        "eunomia-hardware-unit/v1"
      ],
      "type": "string"
    },
    "side": {
      "description": "Camera side (NAND-burned; domain-closed enum). OMITTED for non-cameras (absent, not null \u2014 a nullable enum would reject null structurally).",
      "enum": [
        "left",
        "right"
      ],
      "type": "string"
    },
    "status": {
      "description": "Lifecycle state \u2014 OPEN string, WARN-checked vs {received, provisioned, deployed, faulted, retired} (OQ-A).",
      "type": "string"
    },
    "type": {
      "description": "Device type \u2014 OPEN string (hard-present), WARN-checked vs {fob, camera, sd, gripper} (OQ-A).",
      "minLength": 1,
      "type": "string"
    },
    "unit_id": {
      "description": "Stable unit identity (the anchor).",
      "minLength": 1,
      "type": "string"
    }
  },
  "required": [
    "schema",
    "unit_id",
    "type"
  ],
  "title": "HardwareUnit",
  "type": "object"
}
